Lead ID,Company Name,Contact Person,Phone Number,Email,Industry,Company Size,Inquiry Type,State,City,Intent Score,Priority Level,Lead Source,Inquiry Date,Expected Ship Date,Follow Up Date,Load Origin,Destination,Shipments,Shipment Weight (lbs),Shipment Value ($),Notes,Status,Last Contact,Next Action
6F453BDB,Martinez Ltd,Michelle Ramirez,642-617-7275x7480,swhite@example.org,Healthcare,Large (201-1000),Drayage,WA,Chicago,0.49,Medium,Referral,2025-10-12,2025-11-09,2025-10-18,"Richmond, WA","Birmingham, MS",59,8021,301684,Experience job significant center plant. A growth allow include recently relate recently. Five only tough capital foot.,New,2025-10-14,Follow-up
BA3E0D65,Hayes PLC,James Burns,748-414-4531,davisjonathan@example.com,Automotive,Small (1-50),Intermodal,SC,Houston,0.38,High,Trade Show,2025-09-17,2025-10-26,2025-10-17,"Houston, SC","Pittsburgh, FL",62,8138,148350,"Lead phone card customer matter card why accept. Security break care describe within my.
Computer study section hospital parent describe which.",Closed Lost,2025-10-11,Call
4B5AA2A8,Simmons-Jimenez,Patricia Clark,+1-941-909-1168x733,emily92@example.net,Automotive,Small (1-50),Customs Brokerage,AZ,Detroit,0.79,High,Google Ads,2025-09-27,2025-10-28,2025-10-20,"Cleveland, AZ","New Orleans, SC",2,37464,127409,Yes help beat avoid either mother television. Like remain result little establish. Suggest voice thing arm sure. Behind Mr part wife television.,Proposal Sent,2025-10-15,Proposal
0491479F,Bridges Group,Christine Sampson,824.265.5578x272,youngrebecca@example.net,Food & Beverage,Medium (51-200),3PL Services,WA,Atlanta,0.89,High,Trade Show,2025-09-19,2025-11-03,2025-10-18,"Detroit, WA","New York, IL",46,29776,330267,"Pull whose wind moment.
Agency around quite. He place color network increase remember green. Cost over research at time.
From family state already. Beyond company its dark around these difficult.",New,2025-10-10,Follow-up
7C8ED4C6,Lambert-Peterson,Benjamin Thomas,+1-841-591-2516x693,vargaskimberly@example.org,Energy,Small (1-50),Container Leasing,IL,Cleveland,0.71,Medium,LinkedIn,2025-09-29,2025-11-07,2025-10-18,"Chicago, IL","Phoenix, SC",71,19389,96283,"Teacher team drop find open popular. Treatment space manager campaign. Get recent billion put.
Sell trip fact provide dog body ever. Popular security dream would fast edge amount.",Closed Lost,2025-10-14,Follow-up
F6837358,Brown-Lawrence,Rachel Richmond,+1-819-321-7671x879,bradley46@example.net,Healthcare,Small (1-50),Intermodal,AZ,Houston,0.36,Urgent,Social Media,2025-10-02,2025-10-19,2025-10-19,"Detroit, AZ","Cleveland, AL",53,42488,35400,College view near teacher foreign strong only. Buy now part little manage.,Closed Won,2025-10-10,Meeting
5577D4B1,Hahn-Byrd,Brenda Bennett,472.317.6214x44953,fhopkins@example.org,Chemicals,Medium (51-200),Warehousing,IL,Chicago,0.84,Urgent,Social Media,2025-10-04,2025-10-20,2025-10-22,"Seattle, IL","Chicago, NY",51,16930,110583,"Make note although east main. Move instead street cultural address three bit new.
Party development each. Collection join seek. Today keep whom page.
Record though old program bar amount yet.",Proposal Sent,2025-10-15,Email
66C1467B,White-Lewis,Robert Burch,+1-306-823-0706x1363,burtonnicole@example.org,Manufacturing,Small (1-50),Container Leasing,SC,Newark,0.47,Urgent,Referral,2025-10-03,2025-10-19,2025-10-19,"Cleveland, SC","Seattle, OH",83,1782,84374,"See perhaps may cause. Save pattern partner race deal sell.
Fast read attack degree group system pick. Last event believe exactly.",Qualified,2025-10-13,Close
624F8492,"Landry, Torres and Brown",Juan Davis,(735)304-5293,pachecolucas@example.net,Energy,Small (1-50),Warehousing,TX,Philadelphia,0.87,Medium,Cold Call,2025-08-22,2025-11-02,2025-10-17,"Charlotte, TX","Detroit, NJ",51,2434,163500,World Democrat region if throw open. Both college property able glass sea own.,Qualified,2025-10-11,Meeting
61559FD0,Watson Ltd,Alexander Munoz,762.892.2876x855,mayermark@example.net,Retail,Medium (51-200),Freight Forwarding,OH,Richmond,0.44,High,Social Media,2025-08-23,2025-10-28,2025-10-21,"Charlotte, OH","Houston, CA",63,35950,235471,Full second certainly. Teach production interview nor start activity. Ten size interview catch red involve save.,Qualified,2025-10-10,Follow-up
391DC41E,"Calhoun, Thomas and Hill",Samantha Dixon,831.769.2309x91488,oadams@example.org,Agriculture,Medium (51-200),3PL Services,NY,Cleveland,0.26,Urgent,Trade Show,2025-09-13,2025-10-19,2025-10-19,"Chicago, NY","Cleveland, GA",97,1566,304590,Source painting wrong next above daughter situation. Side box ok enough road. Girl kitchen gas break catch entire possible describe.,Qualified,2025-10-13,Follow-up
7CC7E3C2,"Fischer, Peck and Gomez",Michelle White,382-610-5247x1673,jenkinselizabeth@example.org,Food & Beverage,Small (1-50),Drayage,NY,Charlotte,0.62,High,Website,2025-09-07,2025-10-22,2025-10-22,"Charleston, NY","Miami, NJ",59,5205,404026,Act nothing rest sea management back mind officer. Remain offer whether easy continue south. However agency join federal assume other.,Qualified,2025-10-11,Follow-up
C2DE6CBB,Joyce-Parker,Theresa Tyler,001-596-753-3325,victordean@example.com,Construction,Large (201-1000),Customs Brokerage,PA,Miami,0.62,Urgent,Referral,2025-09-09,2025-11-03,2025-10-22,"Pittsburgh, PA","Chicago, TN",68,24926,296896,Artist pick over although anyone likely book. Usually hand admit will stock develop break.,Closed Lost,2025-10-12,Email
E6FC7AF2,Guerrero LLC,Ann Hoffman,557.944.1785x208,vangnatalie@example.org,Retail,Enterprise (1000+),Intermodal,AL,Memphis,0.43,Urgent,Google Ads,2025-09-05,2025-11-13,2025-10-21,"Richmond, AL","New Orleans, CA",33,28136,188733,"Point your moment service prove. Around practice seek prevent record.
Himself carry name real gun. Parent eye shake long.
Board break oil. Argue party response thank medical. Card she cost almost.",Negotiating,2025-10-14,Close
B8310A18,Martinez LLC,Luke Escobar,(930)864-5666x0369,colonbrandon@example.org,Retail,Small (1-50),NVOCC,NY,New York,0.69,High,Website,2025-10-10,2025-11-11,2025-10-20,"Philadelphia, NY","Los Angeles, TN",54,7606,263672,"Enjoy movement piece interesting full expect.
Cup important consumer very even. Time find short treat later anything. Light ready right his hand allow.",Closed Lost,2025-10-14,Call
CD0168C6,"Mclaughlin, Johnson and Ashley",Sandra Johnson,573-676-4482x874,adrianmelendez@example.org,Automotive,Medium (51-200),Warehousing,FL,Miami,0.53,High,Cold Call,2025-09-17,2025-11-11,2025-10-18,"Atlanta, FL","New York, NJ",77,9567,161235,"Deep specific number situation. Growth remember nor.
Pull condition party herself spend box century. Street force kitchen her though example. Change central half high relate goal itself.",New,2025-10-16,Email
ADD36D40,"West, Ellison and Smith",Julie Walker,001-736-661-8337,kimberlyelliott@example.com,Healthcare,Small (1-50),Intermodal,WA,Charlotte,0.6,Medium,Social Media,2025-08-21,2025-11-09,2025-10-18,"Philadelphia, WA","Newark, PA",21,42197,203447,Collection able eight do rise focus scientist. Professional send national Mrs situation paper. Cause can several senior to manage build.,Qualified,2025-10-14,Email
6BA0E299,Waller LLC,Jennifer Johnson,427.398.1603,allenjoseph@example.com,Food & Beverage,Large (201-1000),Container Leasing,OH,Phoenix,0.63,Low,Cold Call,2025-09-08,2025-11-03,2025-10-20,"Chicago, OH","Indianapolis, MI",66,44946,263996,"Purpose war cover off performance animal. Usually find whatever marriage meet. Easy every southern author many must word.
Sea report pay meet have relate final. Total ask security identify.",Qualified,2025-10-16,Proposal
DA020FD4,"Hamilton, Bauer and Lopez",Matthew Moore,001-391-506-1913x942,wintersjuan@example.org,Healthcare,Large (201-1000),Drayage,VA,Philadelphia,0.56,Low,Trade Show,2025-09-08,2025-10-25,2025-10-17,"Cleveland, VA","Charlotte, NC",50,13944,466776,Mr stock food various kid activity. Concern center draw movie. Property training wish travel model there ask.,Negotiating,2025-10-11,Email
E9D9A71F,"Walker, Moore and Snyder",Colleen Moore,+1-988-675-7344x3201,marymathews@example.org,Construction,Small (1-50),Freight Forwarding,AL,Newark,0.62,Low,Cold Call,2025-08-25,2025-11-12,2025-10-20,"New Orleans, AL","Memphis, IN",44,42551,448581,Toward around success road seat soon drug. Action you gun brother positive team mean. Same hold east week past design choose.,Closed Lost,2025-10-15,Meeting
D36922CD,"Martinez, Castillo and Prince",Nathan Nguyen,(779)862-2160x1723,louiskirk@example.net,Chemicals,Small (1-50),Intermodal,NJ,Los Angeles,0.71,Medium,Website,2025-08-21,2025-10-28,2025-10-18,"Charlotte, NJ","Miami, IL",73,14756,458716,"Nor would police let event now. Top civil top away report. Administration important some center do.
Agree instead company phone who. Deal difficult person attorney.
Cold budget machine sing yet test.",Qualified,2025-10-14,Meeting
9F33FC98,Mcdaniel LLC,Jennifer Wheeler,951.572.5104,mcculloughbeth@example.net,Construction,Medium (51-200),3PL Services,PA,Charlotte,0.72,Medium,Google Ads,2025-09-29,2025-10-22,2025-10-19,"Chicago, PA","Pittsburgh, OH",32,1920,264315,Notice thus explain true difficult meet. Reveal culture beyond in soon.,New,2025-10-10,Follow-up
8661001A,Wilson and Sons,Debbie Harris,+1-860-574-8142x6019,krojas@example.org,Manufacturing,Large (201-1000),Intermodal,NC,Phoenix,0.92,Urgent,Google Ads,2025-08-18,2025-11-08,2025-10-19,"New Orleans, NC","Phoenix, FL",37,43816,455742,Think why strong behind purpose window close husband. Live carry everything bring example cultural. Be summer wind key pattern.,Qualified,2025-10-16,Proposal
10BE9B56,Berry PLC,Katrina Long,+1-239-818-7792x385,xjohnson@example.com,Construction,Large (201-1000),Warehousing,NJ,Indianapolis,0.92,Low,Trade Show,2025-10-08,2025-11-13,2025-10-21,"Miami, NJ","Detroit, VA",86,12393,247436,Again seven owner buy event act boy ten. World stage skin interesting after point unit. Pattern political new day speech activity produce.,New,2025-10-15,Follow-up
2EF5BE8F,Scott-Reynolds,Cheryl Cruz,840.703.7672,hjones@example.org,Healthcare,Medium (51-200),Warehousing,MI,Miami,0.81,Low,Trade Show,2025-09-17,2025-10-29,2025-10-23,"Newark, MI","Birmingham, AZ",51,19248,467332,"Plan degree he sense teacher. Simple technology instead well court until.
Five per wind evening station or. Itself significant war large begin time also.",Closed Lost,2025-10-16,Meeting
0CD6B09C,"Burton, Martinez and Andrews",Andrew Leonard,561.254.3429,teresa20@example.com,Chemicals,Enterprise (1000+),Intermodal,AL,Richmond,0.46,High,Cold Call,2025-09-27,2025-10-28,2025-10-21,"Atlanta, AL","Indianapolis, AZ",86,27136,402478,"Reality produce traditional easy common. Back sister open lay.
Hear consider practice drug. At door heart suggest. Million right herself happen always beyond around.",Qualified,2025-10-10,Call
05859B48,"Cummings, Crawford and Pearson",Tiffany Harmon DDS,(828)425-7308x487,ymartinez@example.net,Healthcare,Large (201-1000),Intermodal,AL,Pittsburgh,0.58,High,Social Media,2025-09-06,2025-11-14,2025-10-22,"Cleveland, AL","Detroit, AZ",73,3183,202535,Style exactly allow owner increase possible special. Fund myself glass no evening from Mr authority.,Negotiating,2025-10-12,Email
85AEFE06,Gross-Roberts,Tara Hernandez,7348442844,garciamadeline@example.org,Chemicals,Medium (51-200),Customs Brokerage,TX,New York,0.32,Urgent,Referral,2025-10-11,2025-10-31,2025-10-23,"Houston, TX","Los Angeles, NC",4,10895,218309,"Toward approach business growth age remember talk.
Cut everything hit. Air second affect food.",Closed Lost,2025-10-11,Email
F5CD2CEE,Allen-Ray,Crystal Miller,740-806-1532x6601,luis99@example.net,Construction,Large (201-1000),Drayage,VA,Atlanta,0.27,Medium,Referral,2025-08-31,2025-10-30,2025-10-23,"Charleston, VA","Seattle, MS",100,15053,223983,Beat national attack security coach usually. Ever teach loss eat report carry night choose. Through support fill watch activity alone south performance.,Closed Lost,2025-10-15,Close
FF9DEE65,"Galloway, Hall and Fernandez",Deanna White,426.887.9644x43215,annacombs@example.org,Healthcare,Enterprise (1000+),NVOCC,FL,Seattle,0.33,Urgent,Cold Call,2025-10-02,2025-10-17,2025-10-21,"Miami, FL","Atlanta, NY",41,35672,41325,Nation skill just finish really difficult message. Physical business increase among.,Proposal Sent,2025-10-16,Proposal
0B35EA4C,"Gray, Fleming and Allen",David Anderson,564.647.4885,sarajones@example.com,Automotive,Small (1-50),Freight Forwarding,CA,Chicago,0.76,Low,LinkedIn,2025-09-12,2025-10-18,2025-10-20,"Birmingham, CA","Newark, AL",62,10196,63707,"Guess list music leg keep choice most. Husband mouth military central remember around call difficult. Same teacher suffer than.
Up society manage total feeling. Public clear science brother.",Closed Won,2025-10-10,Follow-up
10F63D90,"Adams, Tucker and Kemp",Christian Snow,(705)444-1296,emilycruz@example.net,Healthcare,Small (1-50),NVOCC,CA,Charlotte,0.28,Urgent,Social Media,2025-09-21,2025-11-08,2025-10-23,"Los Angeles, CA","Seattle, MS",55,28400,301006,"Tend life visit especially senior.
Design lawyer sound special. Red carry front relate big tonight would. Direction finish say second notice laugh. Term pick true.",Proposal Sent,2025-10-14,Close
675D3C07,"Rogers, Wilson and Howell",Patricia Boyd,4297901996,dixoncathy@example.net,Food & Beverage,Small (1-50),Customs Brokerage,OH,New Orleans,0.81,High,Google Ads,2025-09-04,2025-10-25,2025-10-22,"Miami, OH","Birmingham, TX",96,16085,294746,"All management quickly end oil. Me teach rock use order cell. Brother single pattern.
Piece car such. Hair notice ten chair drug several. Give again customer significant your small mind.",Closed Won,2025-10-14,Meeting
6C769D70,Peters-Harris,Joseph Morgan,+1-772-897-9135x312,catherinecontreras@example.com,Healthcare,Enterprise (1000+),Freight Forwarding,TX,Phoenix,0.33,High,Google Ads,2025-09-07,2025-11-05,2025-10-20,"New York, TX","Birmingham, IL",55,43869,171802,Order much world. Do than range develop. Week reveal audience growth case focus.,Closed Won,2025-10-13,Close
40AA9454,Thomas LLC,Jessica Patterson,(335)562-4362x6719,chelseawyatt@example.com,Technology,Enterprise (1000+),Intermodal,CA,Chicago,0.88,Medium,Cold Call,2025-09-25,2025-11-15,2025-10-21,"Atlanta, CA","Seattle, OH",98,34449,136755,"Foreign tonight call artist. Remain type life study environment. Affect six with full.
Agree school moment test short. Dog threat guy. Man decision out magazine whatever that.",Closed Won,2025-10-13,Email
1D5CB8D1,Bauer-Benson,Jared Fernandez,(479)456-7740x7747,sanchezbrandi@example.com,Construction,Enterprise (1000+),Intermodal,AZ,Seattle,0.36,Urgent,Website,2025-08-26,2025-10-23,2025-10-22,"Philadelphia, AZ","Houston, MS",99,41496,181659,"Author visit lead hold. Investment least course I.
Question skin tough. Probably challenge grow far economy international.",New,2025-10-13,Call
8DF5ECCB,Moore Ltd,Meredith Rodriguez,862-535-7533,rrodgers@example.org,Food & Beverage,Large (201-1000),Drayage,AL,New Orleans,0.91,Urgent,LinkedIn,2025-08-28,2025-11-15,2025-10-21,"Philadelphia, AL","Phoenix, NY",1,49354,258696,"Most room close dream. Fire move price most. Player president if raise and natural firm.
Brother bill new. Hot sort myself part source.",Proposal Sent,2025-10-10,Follow-up
AE7FFC1C,"Patel, Wilson and Johnson",Sherry Cannon,+1-785-777-2911,nrodgers@example.com,Energy,Small (1-50),NVOCC,VA,Charlotte,0.92,Low,Social Media,2025-09-02,2025-11-02,2025-10-18,"Pittsburgh, VA","New York, OH",34,35662,260369,Control establish author note meet audience or. Use among worker better too floor. Federal actually dark large any. Himself sing artist develop quite church among marriage.,Closed Won,2025-10-14,Proposal
027BEF9D,"Powell, Lewis and Garrett",Timothy Rowe,244-254-6332x61661,anne28@example.com,Retail,Large (201-1000),NVOCC,CA,Seattle,0.71,Urgent,Google Ads,2025-09-03,2025-11-12,2025-10-17,"Detroit, CA","Richmond, IL",8,32028,375840,"He national stage join thing daughter interview shake. Parent area myself school statement.
Green police natural go example. Pretty our fish radio. Information information around ever firm today top.",Qualified,2025-10-12,Close
F62218C1,Pena-Richards,Nichole Hall,+1-523-377-6660x96058,joseph29@example.com,Technology,Large (201-1000),Container Leasing,NJ,New Orleans,0.27,Urgent,Email Campaign,2025-09-23,2025-11-01,2025-10-19,"Charleston, NJ","Cleveland, GA",67,19922,73680,Before report message resource. Member successful it mission human manager beautiful reach. Onto pay already day painting son. Stay letter like stand while environment yard.,New,2025-10-12,Email
3D9BCDF8,Lane-Mathews,Mary Adams,348-807-9216x9742,ramirezzachary@example.org,Automotive,Small (1-50),Warehousing,TN,Indianapolis,0.52,Urgent,Google Ads,2025-09-26,2025-10-30,2025-10-19,"Phoenix, TN","Los Angeles, TN",12,35453,469028,"Produce environment never best system never leader.
Morning during cell begin paper realize others. Scene information anything central receive one give you.",In Progress,2025-10-10,Email
E7117F33,Alvarado and Sons,Joseph Hull,258.318.5244x732,taylor39@example.org,Construction,Small (1-50),Warehousing,LA,Philadelphia,0.77,Low,Email Campaign,2025-10-06,2025-10-22,2025-10-19,"Indianapolis, LA","Charleston, IL",62,17699,172614,"Garden believe of interest coach me. Camera film tough issue partner book onto. People a policy result.
Eight could pretty face list green save. Baby relate rise.",Closed Won,2025-10-16,Close
94613340,Mcmillan Group,Christopher Lopez,839.955.6287x03479,nbrewer@example.org,Chemicals,Enterprise (1000+),NVOCC,OH,Los Angeles,0.23,Medium,Social Media,2025-09-03,2025-11-03,2025-10-18,"Chicago, OH","Cleveland, TX",39,32913,253671,"Safe clearly up fly. Rock write spring soon yes. Miss significant reason choose give catch off less.
Up discuss property newspaper get mind. Growth describe edge discuss off.",Closed Won,2025-10-16,Email
813829AC,"Harris, Rodriguez and Robinson",Clifford Davenport,+1-485-964-5285x21225,xkim@example.org,Technology,Medium (51-200),Freight Forwarding,IL,Phoenix,0.26,Urgent,Social Media,2025-08-27,2025-10-24,2025-10-19,"Indianapolis, IL","Atlanta, FL",39,23741,38490,Play friend doctor surface skill. Scientist design soon note condition strong. Like also interest practice throw magazine organization.,Closed Won,2025-10-11,Meeting
DB1AA69F,Murphy Group,Kenneth Turner,+1-243-736-8429,samanthaparsons@example.com,Chemicals,Enterprise (1000+),Freight Forwarding,AL,Atlanta,0.46,Urgent,Trade Show,2025-09-18,2025-10-20,2025-10-23,"Cleveland, AL","Memphis, NY",88,38471,22411,"Office model card garden.
Standard late see color feel capital. Gun these tend price finish. Position education list use action account finish cover.",Qualified,2025-10-13,Close
9A0403DE,Anderson Ltd,Leslie Hess,(212)587-6624x96836,msanchez@example.org,Manufacturing,Small (1-50),Drayage,CA,Detroit,0.72,Medium,LinkedIn,2025-09-27,2025-11-12,2025-10-23,"New York, CA","Miami, NJ",62,34099,203090,Man include player start training. Support let late surface how growth. Church against language call color.,In Progress,2025-10-16,Close
AB891948,"Lindsey, Bowman and Velazquez",Mark Waller,001-616-396-6158x529,westdonna@example.org,Automotive,Medium (51-200),Drayage,NY,Birmingham,0.5,High,Google Ads,2025-09-30,2025-11-05,2025-10-19,"Chicago, NY","Birmingham, SC",65,15660,142236,Bring theory course seat game yes. Until job spring mother. Not away campaign.,Qualified,2025-10-10,Follow-up
D90B7E00,Marshall LLC,Madison Hughes,(738)707-7421x13457,ttanner@example.com,Technology,Large (201-1000),Container Leasing,MS,Seattle,0.59,High,Cold Call,2025-08-27,2025-10-19,2025-10-18,"Atlanta, MS","Los Angeles, NY",5,48678,33143,"Want art maybe itself street physical degree. Common offer though here they continue theory let.
Record risk health voice look no. Former kitchen enter work.
Line treatment though north exactly.",Closed Lost,2025-10-11,Meeting
3DDE0EB0,Bell-Simon,Brandon Simmons,973.523.6344x982,lfry@example.net,Retail,Large (201-1000),Container Leasing,AZ,Indianapolis,0.78,Urgent,LinkedIn,2025-09-15,2025-11-08,2025-10-20,"Los Angeles, AZ","Richmond, NJ",99,45829,412424,Strong discover partner success thought available management. Ability quality product grow already miss.,New,2025-10-16,Meeting
0CBB2720,Edwards-Thornton,Diamond Roy,001-850-690-1439x074,simpsondavid@example.net,Agriculture,Large (201-1000),Intermodal,MI,Charleston,0.39,Low,Referral,2025-09-14,2025-10-20,2025-10-22,"Houston, MI","Phoenix, IL",38,2299,467286,"Station create do walk but his. Decide federal somebody long.
Billion writer role. Actually myself science their likely drop candidate. Tough cut trouble.",New,2025-10-14,Email
36E211C8,"White, Bailey and Ramirez",Misty Miller,(412)894-0368,carrolljohnathan@example.net,Construction,Enterprise (1000+),Drayage,TX,Newark,0.51,Urgent,Social Media,2025-08-18,2025-10-26,2025-10-22,"New Orleans, TX","Cleveland, IN",3,7502,396160,"Lose really call early. Daughter young certain fear look including.
Ahead bring notice thousand. Hear cause work small.",Closed Lost,2025-10-16,Follow-up
45CC9484,"Walters, Mccormick and Wright",Toni Owens,798.325.2272x18822,opaul@example.com,Agriculture,Enterprise (1000+),Customs Brokerage,AL,Cleveland,0.47,Urgent,Website,2025-09-20,2025-10-24,2025-10-23,"Charlotte, AL","Newark, AL",4,32116,86834,"Religious movement plan. Seem expect paper term available.
Involve simply cover. Listen happy remain activity.
Order college our across. Pressure town rest down ground.",Proposal Sent,2025-10-12,Close
4A132278,"Rodriguez, Medina and Johnson",Virginia Oliver,(370)352-3305x4292,sramirez@example.org,Construction,Enterprise (1000+),Freight Forwarding,SC,Charlotte,0.53,Medium,Social Media,2025-09-22,2025-10-31,2025-10-19,"Charlotte, SC","Philadelphia, TN",45,4272,458782,Director plan end accept room general too. Industry cell argue civil forward describe. Total where quality improve know as part.,New,2025-10-15,Proposal
65C22F6A,Townsend-Carter,James Rogers,5327814881,lmorales@example.net,Food & Beverage,Medium (51-200),NVOCC,NC,Birmingham,0.22,Medium,Email Campaign,2025-10-16,2025-10-28,2025-10-22,"Birmingham, NC","Detroit, NC",86,35906,195056,"Than hold couple nature economic school. Knowledge not build teach professional. Idea minute film would.
Who task act. Agent far receive miss lay truth soldier. Sell so someone.",In Progress,2025-10-15,Close
CFAB82AB,Garcia-Stevenson,Danielle Jensen,213.371.6661,marroyo@example.com,Automotive,Enterprise (1000+),Freight Forwarding,NJ,Memphis,0.77,Urgent,Referral,2025-09-08,2025-10-28,2025-10-20,"Charleston, NJ","Miami, VA",62,28303,43627,"Foreign husband stand explain cultural state writer. Maybe anyone choice entire produce.
Case south mention capital. Involve agent sort adult part live.",In Progress,2025-10-16,Email
344AACFF,Adams PLC,Kimberly Oliver,738-652-9955x412,travisturner@example.com,Food & Beverage,Large (201-1000),Warehousing,TX,New York,0.39,Medium,Email Campaign,2025-09-23,2025-10-20,2025-10-19,"Phoenix, TX","Houston, NY",90,14949,362396,"Only term operation team sound. Amount direction part why.
Center cell style late dinner current often. Nice my range play. Clear rock process left style who think.",Qualified,2025-10-12,Call
99047786,Campbell Group,Antonio Moore,+1-829-557-4175x30782,othomas@example.com,Food & Beverage,Small (1-50),Freight Forwarding,OH,New York,0.21,Low,Referral,2025-08-24,2025-10-19,2025-10-18,"Phoenix, OH","Indianapolis, AZ",33,30083,229794,Receive break near program phone rich. Whose outside include. Wife whose full film.,Negotiating,2025-10-15,Close
97CB5662,"Yang, Castro and Gonzales",Alex Anderson,595.361.3687x60490,mcguirejacob@example.org,Agriculture,Small (1-50),Warehousing,IN,Cleveland,0.71,Medium,Email Campaign,2025-09-12,2025-10-22,2025-10-19,"Richmond, IN","New Orleans, TN",78,25809,324480,"Court thus thousand without discuss offer it. Out either same area save training. Know bill arrive form fine role.
Hard heavy suddenly offer notice democratic child. According camera next stage.",Negotiating,2025-10-15,Email
20485E40,"Fletcher, Sanford and Rice",Jennifer Fields,259-398-2398x497,edwardsbrittany@example.net,Construction,Large (201-1000),Container Leasing,VA,New Orleans,0.91,Urgent,Google Ads,2025-10-11,2025-10-31,2025-10-23,"Charlotte, VA","Phoenix, GA",34,37566,398080,"Few or billion cost sport prove figure. Professional catch arm expert improve point.
College top station up eight discuss interest. Win want attack spring growth meet.",In Progress,2025-10-14,Call
4C461305,Lopez-Nguyen,Alan Gross,001-907-312-1882,alan63@example.org,Food & Beverage,Enterprise (1000+),3PL Services,LA,Birmingham,0.29,Medium,Google Ads,2025-09-14,2025-11-08,2025-10-19,"Indianapolis, LA","Houston, PA",50,40098,185924,Need couple best picture together. Local tax future within. Mind moment share use almost much worker.,Qualified,2025-10-16,Follow-up
23F47215,"Jackson, Howard and Chandler",Steven Mcdonald,358.745.7108x9078,mark01@example.net,Manufacturing,Medium (51-200),NVOCC,MS,Seattle,0.35,High,LinkedIn,2025-09-01,2025-11-09,2025-10-22,"Atlanta, MS","New York, IN",11,12180,148177,Senior food wait summer material three way race. Recent behavior main movement spend. Ok ok this conference decade PM central. Fine drug into north least imagine child.,In Progress,2025-10-11,Proposal
3D5EB298,Allison Group,William Schwartz,001-773-247-5319x656,oflowers@example.net,Construction,Enterprise (1000+),Freight Forwarding,WA,Charleston,0.49,Medium,Social Media,2025-09-21,2025-10-28,2025-10-20,"Phoenix, WA","Miami, NC",97,40948,15780,"Everyone line quite forward magazine join. Cell board culture television other pick next.
Series raise improve newspaper compare.",New,2025-10-11,Email
