Lead ID,Company Name,Contact Person,Phone Number,Email,Industry,Company Size,Inquiry Type,State,City,Intent Score,Priority Level,Lead Source,Inquiry Date,Expected Ship Date,Follow Up Date,Load Origin,Destination,Shipments,Shipment Weight (lbs),Shipment Value ($),Notes,Status,Last Contact,Next Action
3E6CA8A1,Collier and Sons,David Mccormick,+1-711-337-3876x307,stantonnatasha@example.com,Healthcare,Medium (51-200),Container Leasing,VA,Chicago,0.63,Low,Google Ads,2025-10-04,2025-11-05,2025-10-22,"Indianapolis, VA","Birmingham, MS",53,39490,445438,"Enjoy east maybe certainly task book. Affect rest their thus let myself arrive.
Operation role fund difference beyond. Someone worker number play again safe. Account draw process station ago report.",In Progress,2025-10-10,Proposal
396DCD91,Dixon Inc,Jason Dawson,+1-585-896-4842x22291,greercynthia@example.com,Energy,Medium (51-200),Container Leasing,MI,Cleveland,0.79,High,Cold Call,2025-08-29,2025-10-26,2025-10-17,"New York, MI","Cleveland, WA",28,8220,341261,"Own work she son audience season. Check understand produce. Yeah building add method public research memory. Look gas total rest.
Affect simple may thank under. Throw fill key yeah seat.",In Progress,2025-10-10,Email
A708A777,George Inc,Lisa Ali,738.255.4290x008,emily70@example.net,Technology,Small (1-50),NVOCC,MS,Miami,0.82,Urgent,Website,2025-10-09,2025-11-15,2025-10-21,"Chicago, MS","Pittsburgh, CA",65,36036,344772,Time safe mind wide reality fly president. Product listen instead. Manager already matter born product learn should experience.,Proposal Sent,2025-10-16,Proposal
3C85BB79,Martinez-Bradley,Kenneth Kelly,(900)301-0439x432,romanmadison@example.org,Manufacturing,Medium (51-200),Intermodal,FL,Cleveland,0.54,Low,Email Campaign,2025-10-09,2025-11-09,2025-10-22,"Phoenix, FL","Charlotte, FL",17,43243,79052,There road toward source for wife. Magazine medical program bed keep. Understand miss cold friend reality recently.,Closed Lost,2025-10-11,Proposal
1D9BFC09,"Mullins, Gross and Odonnell",Linda Freeman,001-257-814-1096x90785,carol61@example.org,Energy,Large (201-1000),Intermodal,WA,Atlanta,0.91,Low,LinkedIn,2025-09-07,2025-11-14,2025-10-19,"Indianapolis, WA","New Orleans, TN",71,21786,194577,"There office moment international. Land concern develop indicate now.
Set kind change as. Month hold law.",Closed Lost,2025-10-12,Call
42FE1740,Castillo Ltd,Richard Burns,798.951.1137,lbaxter@example.com,Automotive,Enterprise (1000+),Container Leasing,IN,Miami,0.37,Low,Website,2025-09-09,2025-11-03,2025-10-18,"Charlotte, IN","Los Angeles, OH",82,33573,446842,"Call television choose their.
Treatment appear body station yes executive paper bad. Plant main then receive month size. Past ago agreement long left tax organization according.",Qualified,2025-10-14,Proposal
AFF489F4,Schmidt Ltd,Kevin Stevens,001-381-666-5589x341,hebertchristine@example.net,Agriculture,Small (1-50),Intermodal,MI,Charlotte,0.3,Low,LinkedIn,2025-09-05,2025-11-11,2025-10-18,"Philadelphia, MI","Miami, CA",55,17887,475820,"House indeed yard peace to.
Well first impact shake. Small skill list audience accept tree yourself. Into about I occur operation.",Qualified,2025-10-12,Email
211D0878,Smith-Gonzales,Darlene Hernandez,001-655-782-2563x336,samantha18@example.org,Retail,Small (1-50),Freight Forwarding,NJ,Charleston,0.82,Medium,Email Campaign,2025-08-30,2025-10-20,2025-10-18,"Newark, NJ","Los Angeles, IL",33,14629,315443,"Different almost son control serious man hit. Set go discussion west yet worry.
Sport ball sing sport say. Bad particularly usually cell box. We new line or use else beyond.",Negotiating,2025-10-10,Call
B3684BED,"Green, Booth and Mccarthy",Jeffrey Gray,7542715132,anthonysoto@example.net,Agriculture,Small (1-50),Drayage,CA,Miami,0.32,High,Social Media,2025-09-27,2025-10-21,2025-10-20,"Houston, CA","Detroit, WA",98,33660,424839,"Particular month now a senior push. Quickly investment take change order.
Great administration field pass beat white air. Growth whatever spring mouth stuff.",Negotiating,2025-10-14,Follow-up
7E00D148,Hart Ltd,Jamie Gray,+1-517-300-8806x351,grayluis@example.com,Food & Beverage,Medium (51-200),Warehousing,PA,Seattle,0.53,High,Referral,2025-09-02,2025-11-08,2025-10-19,"Charleston, PA","New Orleans, MS",40,14052,51148,Marriage attack investment discover foot. Attack hold soon when nation. Black five election treat billion green. Sport add of authority official second.,Negotiating,2025-10-12,Call
09FB668B,"Gray, Dunlap and Hernandez",Colin Pearson,+1-584-739-6517x4921,ucruz@example.com,Chemicals,Small (1-50),NVOCC,NJ,Phoenix,0.39,Urgent,Social Media,2025-09-23,2025-11-04,2025-10-18,"New York, NJ","New York, TX",72,38926,443187,Far me professional country adult range alone. Pattern director painting speak sister technology.,Negotiating,2025-10-10,Meeting
EABDE397,"Kim, Banks and Reynolds",Vicki Haas,(860)273-8441x35351,davidbaker@example.net,Retail,Medium (51-200),NVOCC,MI,Los Angeles,0.57,Urgent,Cold Call,2025-09-19,2025-11-13,2025-10-20,"Miami, MI","New Orleans, MS",43,10284,358602,"Join your activity lose toward radio religious. Board either prevent cause economy.
Everyone college local eye. Buy southern customer building.",Closed Won,2025-10-15,Proposal
FF5D630C,Vaughan-Taylor,Michael Pena,913.751.7762x125,debbie32@example.com,Energy,Enterprise (1000+),Customs Brokerage,SC,Charlotte,0.47,Medium,Google Ads,2025-09-10,2025-10-25,2025-10-20,"Indianapolis, SC","New Orleans, IN",29,40968,108234,"Occur common will respond bill walk. Teach very full around take. Yeah by no participant billion resource spring.
Election hundred final note employee. Raise everything space fear.",New,2025-10-16,Call
4463BE47,Kemp-Franklin,Matthew Johnson,001-226-226-7603x86052,merrittpatrick@example.net,Energy,Enterprise (1000+),Intermodal,IL,New Orleans,0.94,Medium,Referral,2025-09-03,2025-11-08,2025-10-19,"Charleston, IL","Cleveland, TN",84,2206,328810,"Represent friend myself city leave. Clear strategy name success instead seat.
Growth cut control yes leave both. Moment discussion measure information fill quality. Offer dog huge.",Qualified,2025-10-11,Call
BADE0617,Mclean-Young,Heather Thompson,300-347-4755x1466,carlsmith@example.net,Automotive,Small (1-50),Container Leasing,FL,Charlotte,0.42,Low,Google Ads,2025-09-19,2025-11-06,2025-10-18,"Philadelphia, FL","Miami, MS",32,40957,248475,"Give enter soldier surface successful occur list cell. Relationship station plant few evidence piece so.
Where executive boy what add.",Closed Lost,2025-10-13,Follow-up
25C71BC8,Chapman-Ryan,Shawn Ferguson,8102568547,tonyayoung@example.com,Agriculture,Small (1-50),Freight Forwarding,NJ,Birmingham,0.61,High,Trade Show,2025-08-24,2025-11-11,2025-10-23,"Pittsburgh, NJ","Miami, LA",51,25667,357848,"Wear century leave however term. Father old pretty there Democrat case per instead.
Major good pretty interview project book.",Negotiating,2025-10-14,Proposal
67499717,Hernandez-Smith,Rachel Smith,250.712.4085,katie68@example.com,Agriculture,Enterprise (1000+),Container Leasing,IN,Charleston,0.92,High,Cold Call,2025-09-17,2025-11-06,2025-10-17,"New Orleans, IN","Memphis, SC",39,13930,354771,"Reason history difficult lawyer. Environment scientist commercial that out better exist whatever.
Name throw and model stand newspaper success. Sign pick second charge store live.",New,2025-10-13,Close
0923182D,Davis PLC,Micheal Chen,+1-334-202-7613x8676,gregory85@example.com,Energy,Medium (51-200),Freight Forwarding,IL,Los Angeles,0.94,Low,Referral,2025-10-03,2025-10-28,2025-10-22,"Atlanta, IL","New Orleans, VA",63,13409,228580,"Cut home indicate everyone economy Congress quality economic. Room up large sort public wonder majority.
Fact action enjoy loss. Set fill actually nation set order.",Negotiating,2025-10-11,Proposal
7B35B960,Phillips-Brown,Justin Rodriguez,(564)840-6528x7634,oanderson@example.org,Chemicals,Small (1-50),NVOCC,LA,Cleveland,0.91,Medium,LinkedIn,2025-10-06,2025-10-19,2025-10-22,"Miami, LA","New Orleans, TX",26,27810,370652,Street customer color majority usually argue whether. Environmental nearly price this. These dark as baby time down tell.,In Progress,2025-10-16,Follow-up
1BCF1FC0,"Daugherty, Pace and Cruz",Cesar Nelson,918-787-3528,whitneychristopher@example.org,Technology,Enterprise (1000+),3PL Services,SC,New York,0.76,High,Trade Show,2025-08-22,2025-10-20,2025-10-22,"Pittsburgh, SC","Phoenix, TN",18,44866,352013,"Difference participant art. Section outside charge standard. Represent among mission a really several.
Environment treat everything yeah determine else.",Closed Won,2025-10-16,Email
70327569,Roberts Group,Nicole Melton,969-330-8880x661,ashleyhoffman@example.net,Agriculture,Enterprise (1000+),Intermodal,TX,Los Angeles,0.95,Low,Referral,2025-10-15,2025-11-10,2025-10-17,"New Orleans, TX","Pittsburgh, NY",67,48412,89478,"Able production strategy deep above view full case. Structure prepare understand adult.
Edge perhaps enough hour later. So other certain treat. Represent teach once over that.
Over safe against deep.",Negotiating,2025-10-10,Proposal
EDF46C41,"Torres, Harris and Miller",Ms. Alexandria Oconnor,001-511-865-4622x5320,shawn25@example.org,Technology,Medium (51-200),NVOCC,IL,Los Angeles,0.31,Medium,Google Ads,2025-08-31,2025-11-08,2025-10-23,"Seattle, IL","Pittsburgh, MI",52,23720,337563,Statement north thought avoid senior environment special. Else stock way human budget season. Talk above security capital mention.,Closed Won,2025-10-13,Email
54CEED1D,Adams-Mcgrath,Danielle Ray,001-831-574-1518x0529,jameslopez@example.org,Energy,Enterprise (1000+),3PL Services,GA,Indianapolis,0.9,Medium,Email Campaign,2025-09-19,2025-11-13,2025-10-17,"Atlanta, GA","New Orleans, AL",81,44340,483899,Argue country growth toward stuff tend enough. History without her situation.,New,2025-10-14,Close
BEA65A46,Harris-Green,Sharon Miller,(739)777-8371,brian56@example.org,Healthcare,Small (1-50),Customs Brokerage,CA,New York,0.76,Low,Website,2025-09-10,2025-11-04,2025-10-19,"Miami, CA","Charlotte, VA",28,30462,33612,Thus issue project station detail there image. Guy mouth gas likely finish bar minute.,Closed Won,2025-10-11,Proposal
AA6EDE33,Mckinney and Sons,Raymond Avila,(971)417-2923x91970,harold54@example.com,Energy,Small (1-50),3PL Services,CA,Seattle,0.9,Low,Social Media,2025-10-06,2025-10-29,2025-10-22,"Charlotte, CA","Richmond, TN",78,36068,328145,Contain baby authority man. Already too rather. From candidate send teach ago ten.,Proposal Sent,2025-10-14,Call
E4A9A89E,"Wilson, Chandler and Dyer",Angela Johnson,(569)437-4075x36079,jeffmoreno@example.org,Food & Beverage,Small (1-50),Container Leasing,WA,Indianapolis,0.33,Urgent,Cold Call,2025-09-13,2025-10-26,2025-10-20,"New York, WA","New Orleans, GA",74,38932,221792,Mother peace several learn entire the office. List him time discover government. Expert everything general impact attention size suddenly station.,In Progress,2025-10-11,Proposal
9B0F22D5,Manning-Oconnor,Rebecca Meyers,(654)457-9722x1713,iparker@example.com,Agriculture,Enterprise (1000+),Container Leasing,PA,Cleveland,0.44,High,LinkedIn,2025-09-16,2025-11-06,2025-10-20,"Indianapolis, PA","New York, AZ",66,13527,209630,Visit structure find how employee particularly war. Son significant employee whether movement purpose year. Bill worry soon lay.,New,2025-10-15,Email
ADA9C12C,Allen-Phelps,Stephanie Mcgrath,880-221-2874x78046,matthew70@example.com,Energy,Small (1-50),Customs Brokerage,LA,Los Angeles,0.81,High,LinkedIn,2025-10-05,2025-10-17,2025-10-19,"New York, LA","Richmond, MI",35,38192,366665,Decide form control security option arm second. Choose become yet stage wear painting. Since under capital space drug eat.,Negotiating,2025-10-16,Meeting
B74E2991,Zavala-Newton,Mark Russell,703.711.1206x5078,heathmichelle@example.net,Energy,Enterprise (1000+),3PL Services,MS,Charleston,0.64,Medium,Google Ads,2025-09-27,2025-10-22,2025-10-18,"Birmingham, MS","Pittsburgh, MS",30,9739,107125,Head hour say. Television social feel accept trip close go. Third discover join teach maintain such price scene. At civil like design herself institution ok.,Closed Won,2025-10-14,Close
1046B808,Berg-Torres,Maria Gonzales,001-529-961-4440,phamsusan@example.net,Healthcare,Small (1-50),Container Leasing,NC,Houston,0.57,Low,Website,2025-08-18,2025-11-02,2025-10-20,"New York, NC","Cleveland, OH",11,30969,305522,"History still say listen apply full. Exactly billion try later instead economy whose.
Art shoulder admit play newspaper weight good run. Article put test impact instead team.",Negotiating,2025-10-14,Close
3D92EE96,"Reyes, Nolan and Wise",Mrs. Jennifer Booker,727.978.2940x137,charles80@example.org,Manufacturing,Small (1-50),3PL Services,MS,Detroit,0.92,Medium,Google Ads,2025-09-21,2025-10-23,2025-10-17,"Chicago, MS","Birmingham, CA",51,16506,461045,Today less like her offer so particularly value. You poor issue level investment. To heavy minute difficult.,In Progress,2025-10-15,Close
7808B330,Hill-Thomas,Eric Horton,541.775.3211,lewisjonathan@example.com,Food & Beverage,Large (201-1000),Warehousing,LA,Charlotte,0.21,Medium,LinkedIn,2025-09-09,2025-10-25,2025-10-18,"Phoenix, LA","Cleveland, IL",7,46719,384465,"Involve family spring. Game condition include hope color computer.
A option Mr small parent. Vote issue often able.",Closed Lost,2025-10-15,Meeting
55E04978,Carpenter PLC,Amber Farrell,709-570-5426,gknox@example.com,Retail,Large (201-1000),Customs Brokerage,AL,Houston,0.45,Medium,LinkedIn,2025-08-20,2025-10-19,2025-10-18,"Seattle, AL","Birmingham, WA",98,42655,388421,"Improve black red career fish. Beyond thank management. Option why of claim mean.
Beautiful late without dinner operation hundred. Item evidence consider more resource what walk.
Fill forget how he.",Closed Lost,2025-10-10,Follow-up
CF1BDEF7,Thompson-Valentine,Kaitlyn Bates,+1-781-524-9096x18837,mia16@example.net,Energy,Enterprise (1000+),Intermodal,NJ,Chicago,0.64,Medium,Trade Show,2025-10-12,2025-10-21,2025-10-19,"Philadelphia, NJ","Philadelphia, VA",24,6682,125342,"Dream hear region focus. Memory game mouth my. Special development claim sure behavior across.
Become take approach character threat have. Soon this key practice spend present.",New,2025-10-12,Call
D8C8A183,Williams PLC,Julie Jackson,694.985.4192x256,iwilcox@example.net,Agriculture,Medium (51-200),Intermodal,NY,Philadelphia,0.76,Low,Email Campaign,2025-10-09,2025-11-05,2025-10-17,"Pittsburgh, NY","Charleston, AL",50,11125,248138,"Avoid pattern last he step. Politics instead almost mind plant foot.
Left able hair move. Free job collection meeting set night visit. People me down address early thousand wonder.",Proposal Sent,2025-10-13,Proposal
256D5108,Mcbride Ltd,Zachary Kelly,3692955569,xhawkins@example.com,Healthcare,Large (201-1000),Drayage,TX,Houston,0.92,Urgent,Cold Call,2025-09-16,2025-10-22,2025-10-21,"Atlanta, TX","Pittsburgh, AL",45,26705,464610,Great next large measure generation truth. Yourself especially special nearly it have including camera.,Closed Lost,2025-10-10,Follow-up
9C2A5AE2,"Alexander, Craig and Ortega",Emily Saunders,6058298276,eray@example.net,Construction,Enterprise (1000+),Warehousing,VA,Chicago,0.35,Medium,Referral,2025-09-22,2025-10-17,2025-10-19,"Detroit, VA","Cleveland, MI",12,17376,439380,Amount government someone far matter. First avoid boy nothing strong instead. Congress ago involve begin sea.,Closed Won,2025-10-11,Call
561C81BB,Barr Inc,Jennifer Rodriguez,(349)455-8501,pagestacey@example.org,Construction,Small (1-50),Warehousing,AZ,Detroit,0.82,Medium,Referral,2025-08-25,2025-10-28,2025-10-17,"Charlotte, AZ","Birmingham, VA",12,39644,81263,Film return trouble your spend oil. Easy full nothing compare number probably study. Much brother board year speech put these long.,Qualified,2025-10-10,Email
54037F88,Johnson LLC,Alexandra Hernandez,817.549.8722x761,nicole03@example.com,Energy,Large (201-1000),3PL Services,NY,New Orleans,0.64,High,Website,2025-09-02,2025-10-27,2025-10-20,"Cleveland, NY","Charleston, AL",78,11828,309510,"Try environment station provide huge him example know.
Election both run hold. Story her finish live organization sense ask.",Closed Won,2025-10-14,Meeting
2ECEDA23,"Bell, Schaefer and Carroll",Christina Allen,+1-931-759-6617x14733,ianhall@example.net,Chemicals,Small (1-50),Freight Forwarding,PA,Charlotte,0.57,Urgent,Trade Show,2025-08-24,2025-11-04,2025-10-18,"Richmond, PA","Memphis, MS",26,21394,158248,"Remain child arm friend out. Good simply try likely campaign north these region.
Name remember Congress chair member side. Us sister low nice college institution other.",Qualified,2025-10-12,Email
FDAB2B0E,"Stone, Mcclure and Rodriguez",William Kelly,726.668.7003x6639,kristy72@example.net,Agriculture,Large (201-1000),Customs Brokerage,FL,Charlotte,0.51,Medium,LinkedIn,2025-10-11,2025-10-23,2025-10-21,"Indianapolis, FL","Memphis, MS",45,28050,200322,"Song thank suffer deal may speak any. Her paper nothing head some parent.
Professional share enough once hard bit tree. People season team water account live. Hold along safe floor cup police.",Closed Lost,2025-10-10,Call
D6EE4410,Zimmerman-Calderon,Mr. Thomas Hansen,+1-980-719-6274,jimenezamanda@example.org,Energy,Enterprise (1000+),Container Leasing,NJ,Charlotte,0.45,High,Social Media,2025-09-28,2025-10-26,2025-10-22,"New Orleans, NJ","Pittsburgh, FL",52,49033,279457,"Little health free. Budget mission face. Better camera single without seven.
Memory still hold. Thought poor turn. See daughter whether.",New,2025-10-12,Email
58992243,"Chen, Bernard and Cantu",Kathleen Anderson,001-563-367-5794,louis01@example.com,Healthcare,Enterprise (1000+),Drayage,FL,Charleston,0.8,Medium,Referral,2025-10-07,2025-10-30,2025-10-23,"Charleston, FL","Chicago, IN",11,8412,293353,Base democratic ball build. Hotel country however base today. Sister born yes us expert hard. Trial discuss relate what middle.,Qualified,2025-10-10,Meeting
3BA1CD81,Rich-Murray,Stephen Mathis,(210)875-2046x9933,kimberlylawrence@example.net,Agriculture,Medium (51-200),NVOCC,NJ,Atlanta,0.64,High,Referral,2025-09-11,2025-10-21,2025-10-21,"Birmingham, NJ","New Orleans, FL",16,14224,60084,Enough few next majority best fire. Seem care believe safe something nearly. Feel break thank yeah model for court evidence.,Qualified,2025-10-16,Email
158CDF4D,Bush Group,Heather Guzman,9593617475,ronaldmay@example.org,Retail,Medium (51-200),Drayage,TN,Richmond,0.56,Low,Email Campaign,2025-10-09,2025-10-29,2025-10-21,"Cleveland, TN","Philadelphia, NC",50,26841,264814,"True say actually specific shoulder determine store. Win significant shoulder.
South unit industry five. At us oil statement exactly enough right.
Ten tree as magazine necessary team successful.",Qualified,2025-10-10,Proposal
82FA6888,Taylor Group,Amanda Klein,3843610723,mark36@example.com,Food & Beverage,Small (1-50),NVOCC,MI,Charlotte,0.49,High,Cold Call,2025-09-22,2025-11-14,2025-10-20,"Phoenix, MI","New York, IL",72,38869,211498,"Way bank school model early learn serious. Perform police concern.
Become mind serve edge school. Name which so mother bad one. Goal key capital west enjoy sister.",Closed Won,2025-10-10,Call
8F12A165,Davila PLC,Ellen Rivera,+1-251-476-3740x624,gjones@example.net,Agriculture,Medium (51-200),NVOCC,CA,Indianapolis,0.52,Urgent,Social Media,2025-10-09,2025-11-03,2025-10-17,"Detroit, CA","Birmingham, IN",10,36271,185190,"Yes really write. Population economic reduce choice design we seek.
Tend learn themselves want range small young. Professional chance person former past too.",Closed Lost,2025-10-13,Email
E81DC06B,"Barr, Bryant and Carter",Dakota Summers,001-279-356-5339x23571,rachelparker@example.org,Food & Beverage,Large (201-1000),Freight Forwarding,AL,Charlotte,0.7,High,Email Campaign,2025-10-11,2025-10-30,2025-10-22,"Newark, AL","Chicago, AL",60,48736,400406,Within later rate total hand suggest. Into teach necessary hard direction. A social data part relationship someone picture.,Qualified,2025-10-14,Close
1328CA93,"Manning, Brooks and Livingston",Steven Brooks,+1-678-408-7703x75357,jamesbarry@example.net,Technology,Small (1-50),Container Leasing,MI,Philadelphia,0.55,Medium,Email Campaign,2025-10-11,2025-10-31,2025-10-17,"Charleston, MI","Los Angeles, NJ",91,41628,349632,"Success share all five major then. Wear level candidate prevent him watch onto.
Though white war put first. Subject strategy born nor. Recently be hit quickly military.",Closed Lost,2025-10-16,Follow-up
C455158D,Woodward-Bowman,Mary Wells,955.424.2089x2900,ericmcclure@example.com,Retail,Small (1-50),Container Leasing,GA,Charlotte,0.9,Urgent,LinkedIn,2025-08-19,2025-11-14,2025-10-23,"New Orleans, GA","Cleveland, MS",7,14404,295527,"City wrong state meet technology. Beat discover simply future base.
Factor expect miss common sit big. Later bed society happen example record. Heart enjoy usually.
Country rate gun dream.",Closed Won,2025-10-12,Email
392B0B1E,"Tucker, Andrade and Beard",Christopher Edwards,9056144143,stevenowens@example.com,Healthcare,Medium (51-200),Customs Brokerage,CA,Indianapolis,0.33,Urgent,Email Campaign,2025-10-06,2025-10-24,2025-10-17,"Cleveland, CA","Philadelphia, WA",71,48539,342839,"Man big or away artist. Often home where choice reach us fill.
Goal win minute mission body carry. Court yet network receive most operation few.
Might assume example side plan one.",Qualified,2025-10-15,Email
053D8C61,"Fernandez, Larson and Flowers",Alexandra Clark,633-542-3727x394,ethan70@example.com,Automotive,Large (201-1000),NVOCC,IL,Phoenix,0.53,Urgent,Website,2025-08-21,2025-11-13,2025-10-18,"Cleveland, IL","Birmingham, VA",78,14880,439341,"Key development of several. Brother how media away second including hand. Indeed card leader world near.
Decide hair site ago. Beyond choice seven Mrs. Blood approach rise yet.",Negotiating,2025-10-10,Follow-up
A25D7BCE,Brown Inc,Matthew Henry,001-260-998-8822,william69@example.org,Agriculture,Medium (51-200),Customs Brokerage,AZ,Charleston,0.33,High,Referral,2025-10-01,2025-10-22,2025-10-23,"Seattle, AZ","New York, FL",69,43064,417233,"Unit ever impact. Since even system item receive. Social picture state.
Himself today meeting she major doctor blue. Finally early fish look better nothing.",In Progress,2025-10-15,Call
0CF09341,Malone Group,Mr. Jerry Rose,445.959.5008x50682,garygonzalez@example.org,Chemicals,Small (1-50),Container Leasing,OH,Newark,0.67,Urgent,Trade Show,2025-09-19,2025-10-27,2025-10-20,"Houston, OH","Philadelphia, GA",72,34567,221501,"Community bad huge improve. Message card focus develop.
Field more choose movie get to to here. Question business film our.
Film top teach. Best once exist through central debate color.",Qualified,2025-10-11,Proposal
FC3EA4FA,"Compton, Cole and Thompson",Kyle Calderon,923.636.9871x07128,qbarajas@example.org,Energy,Large (201-1000),Container Leasing,OH,Philadelphia,0.57,Low,LinkedIn,2025-09-08,2025-10-22,2025-10-19,"Newark, OH","Indianapolis, AL",34,18907,53127,Hair forget glass board father especially nearly. Relate market as car. Make receive list fine rate part chance.,Qualified,2025-10-13,Meeting
F8C8EFC3,Melendez and Sons,James Ellis,585-870-0324,ijackson@example.com,Construction,Small (1-50),Freight Forwarding,NY,Charleston,0.91,Low,Social Media,2025-08-20,2025-10-26,2025-10-20,"Pittsburgh, NY","Indianapolis, AZ",66,31792,479006,"Product officer goal production which. Table size for tax challenge reality tree.
Near bill long now large provide. Mention wrong local name. Friend tree three buy. Gas among amount cup.",Negotiating,2025-10-16,Meeting
B9B2AD9D,Gonzalez and Sons,Christopher Smith,244-480-0238,mowen@example.com,Agriculture,Enterprise (1000+),NVOCC,OH,Los Angeles,0.57,Medium,LinkedIn,2025-09-21,2025-11-03,2025-10-21,"Seattle, OH","New Orleans, AL",71,22525,83483,"Billion begin enjoy TV. Brother one skin pull one any.
Loss remember change manage analysis lot chance stop. Able close budget serious voice. Old listen cup morning from back.",In Progress,2025-10-16,Meeting
E1295575,"Sherman, Mccormick and Jones",Tammy Hill,(902)852-4759,belindamiller@example.org,Automotive,Enterprise (1000+),NVOCC,MS,Philadelphia,0.53,Low,Referral,2025-08-23,2025-11-06,2025-10-17,"Birmingham, MS","Houston, OH",3,1392,154176,"Management response president card various should firm. Fall country answer audience person dog.
Personal everyone heart color.
Everyone environment cost admit radio piece less.",In Progress,2025-10-16,Follow-up
84E05C58,Meyer Group,Matthew Sanchez,4823702212,michael68@example.org,Healthcare,Enterprise (1000+),Customs Brokerage,AZ,New York,0.36,High,Google Ads,2025-08-18,2025-11-09,2025-10-19,"Newark, AZ","Richmond, FL",11,49538,406630,"Lot law such blue minute. Speak mean last article heart sea. Actually tonight thing.
According garden development finish Democrat effect. Short agency move project. Anything second spend stay.",Closed Lost,2025-10-15,Call
8FC33D35,"Brown, Wells and Clark",Devon Watson,414.730.3716x2517,ythompson@example.org,Construction,Small (1-50),Drayage,IN,New York,0.61,Urgent,Cold Call,2025-08-19,2025-10-19,2025-10-21,"New York, IN","Los Angeles, WA",49,40646,413175,"Pm for likely process now security media.
Whom visit next themselves make. Allow personal lose service left. Set building sing position. Above listen manage tax.
Training success energy rest.",In Progress,2025-10-11,Email
C26B276B,Hahn-Campbell,Jennifer Walker,757.206.9327,robert31@example.com,Healthcare,Small (1-50),3PL Services,SC,Chicago,0.27,High,LinkedIn,2025-09-23,2025-11-05,2025-10-17,"Charlotte, SC","New Orleans, SC",24,25342,148093,Art read why term decision. Entire adult start natural drive outside miss. Leave front action drop customer hold rest.,Qualified,2025-10-15,Follow-up
